{
  "$schema": "http://json-schema.org/draft-07/schema#",
  "description": "",
  "type": "object",
  "properties": {
    "type": {
      "type": "string",
      "minLength": 1
    },
    "hideBorders": {
      "type": "boolean"
    },
    "timebarHeight": {
      "type": "number"
    },
    "timebarCollapsed": {
      "type": "boolean"
    },
    "title": {
      "type": "string",
      "minLength": 1
    },
    "sessionName": {
      "type": "string",
      "minLength": 1
    },
    "domainName": {
      "type": "string",
      "minLength": 1
    },
    "views": {
      "type": "array",
      "uniqueItems": true,
      "minItems": 1,
      "items": {
        "required": [
          "windowState"
        ],
        "properties": {
          "oId": {
            "type": "string",
            "minLength": 1
          },
          "path": {
            "type": "string",
            "minLength": 1
          },
          "geometry": {
            "type": "object",
            "properties": {
              "kind": {
                "type": "string"
              },
              "x": {
                "type": "number"
              },
              "y": {
                "type": "number"
              },
              "w": {
                "type": "number"
              },
              "h": {
                "type": "number"
              },
              "maxH": {
                "type": "number"
              },
              "maxW": {
                "type": "number"
              }
            },
            "required": [
              "x",
              "y",
              "w",
              "h"
            ]
          },
          "hideBorders": {
            "type": "boolean"
          },
          "windowState": {
            "type": "string",
            "minLength": 1
          }
        }
      }
    }
  },
  "required": [
    "type",
    "title",
    "views"
  ],
  "additionalProperties": false
}
