{
  "type": "Page",
  "hideBorders": false,
  "timebarHeight": 140,
  "timebarCollapsed": false,
  "title": "FMD page",
  "views": [
    {
      "oId": "oid:views/text30.json",
      "geometry": {
      "kind": "Relative",
      "x": 0,
      "y": 0,
      "w": 6,
      "h": 14
      },
      "windowState": "Normalized"
    },
    {
      "oId": "oid:views/plotview4.json",
      "geometry": {
        "kind": "Relative",
        "x": 6,
        "y": 0,
        "w": 6,
        "h": 14
      },
      "windowState": "Normalized"
    }
  ]
}
